{
    "id": "123e4567-e89b-12d3-a456-426614174000",
    "code": "CPG001",
    "description": {
        "translations": [
            {
                "languageTag": "de",
                "text": "Deutscher Text"
            },
            {
                "languageTag": "en-GB",
                "text": "English text"
            }
        ]
    },
    "erpTenantIds": [
        "123e4567-e89b-12d3-a456-426614174001"
    ],
    "activeForPriceBookCustomer": false
}